{
  "run_id": "20260830T144026+0800_b82eb55_release_x11",
  "timestamp": "20260830T144026+0800",
  "checkpoint": "M0-1.b",
  "contract_version": "V1.1",
  "script_version": "M0-1.b-3",
  "scenario_version": "M0-1.b-v2",
  "run_mode": "formal",
  "sample_profile": {
    "frontend_formal_samples": 0,
    "idle_seconds": 60,
    "resource_cycle_formal_samples": 20,
    "terminal_formal_samples": 3
  },
  "artifact": {
    "profile": "release",
    "binary_sha256": "6adb8197130f3ea278693dc4df61321b6097cf93b9b068678e5b626de63024eb",
    "binary_bytes": 9135520,
    "expected_binary_sha256": "6adb8197130f3ea278693dc4df61321b6097cf93b9b068678e5b626de63024eb",
    "matches_expected": true
  },
  "repo_root": "/home/ainfinit/.codex/worktrees/7350/mvp-browser-os-v3",
  "worktree_clean_at_start": true,
  "git": {
    "commit_sha": "b82eb55a0fd5d11f572753b9c17e929c47c787d0",
    "short_sha": "b82eb55",
    "branch": "feature-M0-baseline"
  },
  "status": "PASS",
  "driver_selfcheck": {
    "status": "PASS",
    "detail": "proc-snapshot(root_pid=957257,members=1,rss/fd readable=1); stats(10,20,30)->{\"median\": 20.0, \"min\": 10.0, \"max\": 30.0, \"volatility\": \"100.0%\", \"p95\": null, \"ols_slope\": 10.0, \"last_minus_first\": 20.0, \"pct\": 200.0}"
  },
  "measurements": {
    "ok": true
  },
  "blocked": [],
  "deferred": [
    {
      "metric": "script_first_response_ms",
      "status": "DEFERRED(M2-4)"
    },
    {
      "metric": "database_first_row_ms",
      "status": "DEFERRED(M4-3)"
    }
  ],
  "evidence": {
    "run_dir": "logs/m0-baseline/20260830T144026+0800_b82eb55_release_x11",
    "environment": "environment.json",
    "scenario": "scenario.json",
    "summary_json": "summary.json",
    "summary_md": "summary.md",
    "sha256sums": "SHA256SUMS"
  }
}
